<?xml version="1.0" encoding="UTF-8"?>
<!DOCTYPE Actores SYSTEM "Actores1.dtd">
<Actores>
    <Actor id="A59">
        <Nome>Eliabeth Shue</Nome>
        <Sexo>muller</Sexo>
        <DataNacemento formato="dd/mm/aaaa"> 06/10/1963</DataNacemento>             
    </Actor>
    <Actor id="A139">
        <Nome>Jhonny Depp</Nome>
        <Sexo>home</Sexo>
        <DataNacemento formato="dd/mm/aaaa">09/06/1963</DataNacemento>       
    </Actor>
    <Actor id="A100">
        <Nome>Harrison Ford</Nome>
        <Sexo>home</Sexo>
        <DataNacemento formato="dd/mm/aaaa">13/07/1943</DataNacemento>       
    </Actor>    
        <Actor id="A120">
        <Nome>Demi Moore</Nome>
        <Sexo>muller</Sexo>
        <DataNacemento formato="dd/mm/aaaa">13/10/1966</DataNacemento>       
    </Actor>    
        <Actor id="A40">
        <Nome>Diane Keaton</Nome>
        <Sexo>muller</Sexo>
        <DataNacemento formato="dd/mm/aaaa">15/01/1952</DataNacemento>       
    </Actor>    
</Actores>